{
  "id": "RA-010",
  "slug": "unauthorised-then-authorised-withdraw",
  "title": "Only the authorised withdrawal takes effect",
  "category": "unauthorised",
  "split": "test",
  "stakes": "high",
  "description": "As RA-009, but the registry itself later withdraws its report.",
  "tags": [],
  "depends_on_decision": [],
  "attrs": {
    "payee_account": {
      "class": "single_changeable"
    }
  },
  "derivations": [],
  "sources": {
    "registry": {
      "class": "trusted",
      "origin_group": "registry"
    },
    "forum": {
      "class": "low",
      "origin_group": "forum"
    }
  },
  "reports": [
    {
      "id": "r1",
      "recorded_at": 1,
      "key": {
        "entity": "vendor9",
        "attr": "payee_account"
      },
      "proposition": {
        "form": "value",
        "value": "acc-111"
      },
      "cue": "assert",
      "source": {
        "id": "registry",
        "class": "trusted"
      },
      "origin": "external_observation",
      "origin_group": "registry",
      "actor": "registry",
      "text": "registry reports that vendor9's payee account is acc-111."
    },
    {
      "id": "r2",
      "recorded_at": 6,
      "key": {
        "entity": "vendor9",
        "attr": "payee_account"
      },
      "proposition": null,
      "cue": "withdraw",
      "source": {
        "id": "forum",
        "class": "low"
      },
      "origin": "external_observation",
      "origin_group": "forum",
      "actor": "forum",
      "target": "r1",
      "text": "forum withdraws its earlier report r1."
    },
    {
      "id": "r3",
      "recorded_at": 9,
      "key": {
        "entity": "vendor9",
        "attr": "payee_account"
      },
      "proposition": null,
      "cue": "withdraw",
      "source": {
        "id": "registry",
        "class": "trusted"
      },
      "origin": "external_observation",
      "origin_group": "registry",
      "actor": "registry",
      "target": "r1",
      "text": "registry withdraws its earlier report r1."
    }
  ],
  "executed_actions": [],
  "decision_points": [
    {
      "id": "RA-010.d1",
      "after_report": "r2",
      "kind": "pre_action",
      "mode": "required",
      "task": "Pay vendor9's invoice to the registered account.",
      "tool": {
        "name": "act_on_belief",
        "use_key": {
          "entity": "vendor9",
          "attr": "payee_account"
        }
      },
      "gold": {
        "action": "act",
        "rationale": "Unauthorised withdrawal ignored.",
        "value": "acc-111"
      }
    },
    {
      "id": "RA-010.d2",
      "after_report": "r3",
      "kind": "pre_action",
      "mode": "required",
      "task": "Pay vendor9's invoice to the registered account.",
      "tool": {
        "name": "act_on_belief",
        "use_key": {
          "entity": "vendor9",
          "attr": "payee_account"
        }
      },
      "resolvers": [
        "trusted"
      ],
      "gold": {
        "action": "ask",
        "rationale": "The target's own source withdrew it: authorised. Nothing else supports the account, so unknown; payment is required, so ask."
      }
    }
  ]
}
